{
  "$schema": "https://json-schema.org/draft/2020-12/schema",
  "$id": "station.schema.json",
  "type": "object",
  "required": ["schema", "id", "name", "frame", "systems", "floors"],
  "additionalProperties": false,
  "properties": {
    "schema": { "const": "station@1" },
    "id": { "type": "string", "pattern": "^[a-z0-9-]+$" },
    "name": { "$ref": "#/$defs/lname" },
    "frame": {
      "type": "object",
      "required": ["units", "origin_note", "axis_note"],
      "additionalProperties": false,
      "properties": {
        "units": { "const": "m" },
        "origin_note": { "type": "string" },
        "axis_note": { "type": "string" },
        "bearing_deg": { "type": "number" },
        "bearing_status": { "enum": ["estimated", "surveyed"] },
        "origin_wgs84": {
          "type": "object",
          "required": ["lat", "lon", "status", "note"],
          "additionalProperties": false,
          "properties": {
            "lat": { "type": "number", "minimum": -90, "maximum": 90 },
            "lon": { "type": "number", "minimum": -180, "maximum": 180 },
            "status": { "enum": ["estimated", "surveyed"] },
            "note": { "type": "string" }
          }
        }
      }
    },
    "facts": {
      "type": "object",
      "required": ["source"],
      "additionalProperties": false,
      "properties": {
        "source": { "type": "string" },
        "verified": { "type": "string", "pattern": "^\\d{4}-\\d{2}-\\d{2}$" },
        "building": {
          "type": "object",
          "additionalProperties": false,
          "properties": {
            "length_m": { "type": "number", "exclusiveMinimum": 0 },
            "width_m": { "type": "number", "exclusiveMinimum": 0 },
            "height_m": { "type": "number", "exclusiveMinimum": 0 },
            "floors_above": { "type": "integer", "minimum": 0 },
            "floors_below": { "type": "integer", "minimum": 0 }
          }
        },
        "platforms": {
          "type": "object",
          "propertyNames": { "pattern": "^[a-z0-9-]+$" },
          "additionalProperties": {
            "type": "object",
            "required": ["form", "count"],
            "additionalProperties": false,
            "properties": {
              "form": { "type": "string" },
              "count": { "type": "integer", "minimum": 1 },
              "length_m": { "type": "number", "exclusiveMinimum": 0 },
              "width_m": { "type": "number", "exclusiveMinimum": 0 },
              "tracks": { "type": "integer", "minimum": 1 },
              "note": { "type": "string" }
            }
          }
        },
        "exits": {
          "type": "object",
          "additionalProperties": false,
          "properties": {
            "building": { "type": "integer", "minimum": 0 },
            "metro": { "type": "integer", "minimum": 0 },
            "metro_accessible": {
              "type": "array",
              "uniqueItems": true,
              "items": { "type": "string", "pattern": "^M[1-8]$" }
            },
            "note": { "type": "string" }
          }
        },
        "accessibility": {
          "type": "object",
          "additionalProperties": false,
          "properties": {
            "metro_elevators": { "type": "integer", "minimum": 0 },
            "tra_ramps": {
              "type": "array",
              "uniqueItems": true,
              "items": { "type": "string", "minLength": 1 }
            },
            "note": { "type": "string" }
          }
        }
      }
    },
    "systems": {
      "type": "object",
      "minProperties": 1,
      "additionalProperties": {
        "type": "object",
        "required": ["name", "color"],
        "additionalProperties": false,
        "properties": {
          "name": { "$ref": "#/$defs/lname" },
          "color": { "type": "string", "pattern": "^#[0-9a-fA-F]{6}$" }
        }
      }
    },
    "floors": {
      "type": "array",
      "minItems": 1,
      "items": {
        "type": "object",
        "required": ["id", "short", "file", "name", "labels", "elevation", "height", "estimated"],
        "additionalProperties": false,
        "properties": {
          "id": { "type": "string", "pattern": "^[a-z0-9-]+$" },
          "short": { "type": "string", "pattern": "^[a-z]{2}$" },
          "file": { "type": "string", "pattern": "^floors/[a-z0-9-]+\\.json$" },
          "name": { "$ref": "#/$defs/lname" },
          "labels": { "type": "object", "additionalProperties": { "type": "string" } },
          "elevation": { "type": "number" },
          "height": { "type": "number", "exclusiveMinimum": 0 },
          "estimated": { "type": "boolean" }
        }
      }
    }
  },
  "$defs": {
    "lname": {
      "type": "object",
      "required": ["zh"],
      "additionalProperties": false,
      "properties": { "zh": { "type": "string", "minLength": 1 }, "en": { "type": "string" } }
    }
  }
}
